{
  "profile": "https://forever.works/profiles/ecosystem-composition",
  "profileVersion": "0.1",
  "provenance": {
    "sourceType": "agent-proposed",
    "reviewStatus": "unreviewed"
  },
  "ecosystems": [
    {
      "id": "ecosystem.transfer",
      "intentRefs": [
        {
          "id": "intent.remote-transfer",
          "kind": "intent"
        }
      ],
      "participantRefs": [],
      "obligationRefs": [
        "obligation.suite"
      ]
    }
  ],
  "participants": [],
  "contracts": [
    {
      "id": "contract.transfer",
      "kind": "semantic",
      "statement": "Preserve streaming without buffering the entire transfer.",
      "requirementRefs": [
        {
          "id": "capability.streaming",
          "kind": "capability"
        },
        {
          "id": "invariant.bounded-memory",
          "kind": "invariant"
        }
      ]
    }
  ],
  "interactions": [],
  "states": [],
  "configurations": [
    {
      "id": "configuration.full",
      "participants": [],
      "interactions": [],
      "obligationRefs": [
        "obligation.suite"
      ]
    }
  ],
  "obligations": [
    {
      "id": "obligation.suite",
      "scope": {
        "kind": "ecosystem",
        "ref": "ecosystem.transfer"
      },
      "requirementRefs": [
        {
          "id": "capability.streaming",
          "kind": "capability"
        }
      ],
      "configurationRefs": [],
      "evidenceRefs": []
    }
  ],
  "evidence": []
}
